<classes
    xmlns="http://tierno.es/poo"
    xmlns:xsi="http://www.w3.org/2001/XMLSchema-instance"
    xsi:schemaLocation="http://tierno.es/poo poo.xsd">
    <final>
        <definition>Clase final que no admite herencia</definition>
        <declaration language="java">public final class [name] { }</declaration>
        <declaration language="php">final class [name] { }</declaration>
    </final>
    
    <abstract>
        <definition>Clase de la que no se pueden instanciar objetos</definition>
        <declaration language="java">public abstract class [name]</declaration>
        <declaration language="php">abstract class [name]</declaration>
    </abstract>
</classes>